{
  "schema_version": "adk-skill-content-contract/v2",
  "identity_source": "manifest.json",
  "coverage": "all-manifest-core-and-optional-skills",
  "policy": {
    "primary_invariant": "exactly-one-primary-after-eligibility-filter",
    "effect_ceiling_semantics": "upper-bound-not-authorization",
    "production_behavior_without_authority": "not-measured"
  },
  "derivation": {
    "capability_class_by_pattern": {
      "tool-wrapper": "tool",
      "generator": "task",
      "reviewer": "task",
      "inversion": "support",
      "pipeline": "workflow",
      "playbook": "task",
      "governance": "guardrail"
    },
    "effect_ceiling_by_category": {
      "routing": "read-only",
      "intake": "read-only",
      "planning": "read-only",
      "design": "read-only",
      "implementation": "workspace-write",
      "debugging": "diagnostic-execution",
      "verification": "diagnostic-execution",
      "review_quality": "read-only",
      "release_closure": "release-preparation",
      "governance": "read-only"
    },
    "runtime_role_resolution": "override-else-support-knowledge-supporting-guardrail-governance-else-manifest-activation",
    "selection_group_resolution": "override-else-manifest-category",
    "eval_obligations": {
      "trigger": true,
      "behavior": true,
      "authority_for": ["workflow", "guardrail", "tool", "meta"]
    }
  },
  "overrides": {
    "adk-runtime-router": {"capability_class":"meta","runtime_role":"primary","selection_group":"runtime-routing"},
    "adk-context-engineering": {"capability_class":"support","runtime_role":"supporting","selection_group":"context-policy"},
    "adk-token-context-governance": {"capability_class":"guardrail","runtime_role":"primary","selection_group":"context-policy"},
    "adk-structured-requirements-questioning": {"capability_class":"support","runtime_role":"supporting","selection_group":"requirements-intake"},
    "adk-lightweight-planning": {"capability_class":"workflow","runtime_role":"primary","selection_group":"planning"},
    "adk-parallel-agent-governance": {"capability_class":"workflow","runtime_role":"primary","selection_group":"parallel-governance"},
    "adk-worktree-governance": {"capability_class":"guardrail","runtime_role":"primary","selection_group":"workspace-governance","effect_ceiling":"workspace-write"},
    "adk-context-compress-handoff": {"capability_class":"workflow","runtime_role":"primary","selection_group":"handoff-context","effect_ceiling":"read-only"},
    "adk-adr-writer": {"capability_class":"task","runtime_role":"primary","selection_group":"architecture-documentation"},
    "adk-component-api-stability": {"capability_class":"guardrail","runtime_role":"primary","selection_group":"api-stability"},
    "adk-bsp-analysis": {"selection_group":"bsp-analysis","effect_ceiling":"read-only"},
    "adk-planning-execution-loop": {"capability_class":"workflow","runtime_role":"primary","selection_group":"execution-governance","effect_ceiling":"workspace-write"},
    "adk-driver-bringup-checklist": {"capability_class":"task","runtime_role":"primary","selection_group":"driver-development","effect_ceiling":"workspace-write"},
    "adk-interrupt-dma-patterns": {"capability_class":"task","runtime_role":"primary","selection_group":"interrupt-dma"},
    "adk-cmake-cross-build": {"capability_class":"tool","runtime_role":"primary","selection_group":"build","effect_ceiling":"build-artifact-write"},
    "adk-code-simplification": {"capability_class":"task","runtime_role":"primary","selection_group":"refactor","effect_ceiling":"workspace-write"},
    "adk-systematic-debugging": {"capability_class":"workflow","runtime_role":"primary","selection_group":"debugging"},
    "adk-embedded-debug-transport": {"capability_class":"tool","runtime_role":"primary","selection_group":"debug-transport"},
    "adk-test-strategy": {"capability_class":"workflow","runtime_role":"primary","selection_group":"test-strategy","effect_ceiling":"read-only"},
    "adk-embedded-diagnostic-harness": {"capability_class":"tool","runtime_role":"primary","selection_group":"diagnostic-harness"},
    "adk-artifact-gating": {"capability_class":"guardrail","runtime_role":"governance","selection_group":"artifact-gating","effect_ceiling":"read-only"},
    "adk-verification-before-completion": {"capability_class":"guardrail","runtime_role":"primary","selection_group":"completion-verification","effect_ceiling":"read-only"},
    "adk-chinese-commit-conventions": {"capability_class":"support","runtime_role":"supporting","selection_group":"commit-quality"},
    "adk-chinese-code-review": {"capability_class":"support","runtime_role":"supporting","selection_group":"code-review"},
    "adk-code-review-loop": {"capability_class":"workflow","runtime_role":"primary","selection_group":"code-review"},
    "adk-static-analysis-c-cpp": {"capability_class":"tool","runtime_role":"primary","selection_group":"static-analysis","effect_ceiling":"diagnostic-execution"},
    "adk-commit-pr-quality-gate": {"capability_class":"guardrail","runtime_role":"primary","selection_group":"commit-pr-gate"},
    "adk-production-field-readiness": {"capability_class":"guardrail","runtime_role":"primary","selection_group":"field-readiness","effect_ceiling":"read-only"},
    "adk-cross-team-handoff": {"capability_class":"support","runtime_role":"supporting","selection_group":"handoff","effect_ceiling":"read-only"},
    "adk-after-action-review": {"capability_class":"workflow","runtime_role":"primary","selection_group":"after-action-review","effect_ceiling":"read-only"},
    "adk-memory-curator": {"capability_class":"task","runtime_role":"primary","selection_group":"memory-governance"},
    "adk-archive-governance": {"capability_class":"guardrail","runtime_role":"primary","selection_group":"archive-governance"},
    "adk-knowledge-archive": {"capability_class":"task","runtime_role":"primary","selection_group":"knowledge-archive","effect_ceiling":"workspace-write"},
    "adk-engineering-growth-review": {"capability_class":"task","runtime_role":"primary","selection_group":"engineering-review"},
    "adk-external-practice-absorption": {"capability_class":"workflow","runtime_role":"primary","selection_group":"external-practice","effect_ceiling":"external-read"},
    "adk-data-fetch": {"capability_class":"tool","runtime_role":"supporting","selection_group":"data-fetch","effect_ceiling":"external-read"},
    "adk-email-imap-fetch": {"capability_class":"tool","runtime_role":"supporting","selection_group":"data-fetch","effect_ceiling":"external-read"},
    "adk-fetch-url-content": {"capability_class":"tool","runtime_role":"supporting","selection_group":"data-fetch","effect_ceiling":"external-read"},
    "adk-test-flakiness-triage": {"capability_class":"task","runtime_role":"primary","selection_group":"test-flakiness","effect_ceiling":"diagnostic-execution"},
    "adk-security-supply-chain": {"capability_class":"guardrail","runtime_role":"primary","selection_group":"supply-chain-security","effect_ceiling":"read-only"},
    "adk-incident-rca-report": {"capability_class":"support","runtime_role":"fallback","selection_group":"incident-report","effect_ceiling":"read-only"},
    "adk-skill-composition-governance": {"capability_class":"meta","runtime_role":"primary","selection_group":"skill-governance","effect_ceiling":"read-only"},
    "adk-branch-closeout": {"capability_class":"workflow","runtime_role":"primary","selection_group":"branch-closeout","effect_ceiling":"release-preparation"}
  }
}
